{
  "$schema": "journal_schema.json",
  "format_version": "2.0",
  "session": {
    "session_id": "v38",
    "branch": "develop",
    "started_at": "2026-04-04 09:05 CT (14:05 UTC)",
    "previous_version": "v37"
  },
  "turns": [
    {
      "turn_number": 1,
      "timestamp_ct": "2026-04-04 09:05 CT",
      "timestamp_utc": "2026-04-04 14:05 UTC",
      "user_input": {
        "raw": "Let's modify the approach a little. The latest turn-by-turn conversation + tool call-response journal should not be compressed. It should be laid out in a nice format in case someone reads the JSON in a web-facing repo (so a prettified JSON, not one single line). The previous cut's JSON should, however, be compressed (and the previous Session Log should have its hyperlink point at the compressed .json.tar.gz once that happens) when the latest cut happens. Got it? This way it will be easier to work out what happened if one was on the go and was checking GitHub, plus no need then to deflate to double check that the latest verbose journal material reflected reality. Make sense?",
        "proofread": "Let's modify the approach a little. The latest turn-by-turn conversation and tool call-response journal should not be compressed. It should be laid out in a nicely formatted, prettified JSON in case someone reads it in a web-facing repo (not one single line). The previous cut's JSON should, however, be compressed (and the previous session log should have its hyperlink point at the compressed .json.tar.gz once that happens) when the latest cut happens. This way it will be easier to work out what happened if one is on the go checking GitHub, plus no need to deflate to double-check that the latest verbose journal material reflects reality.",
        "source": "user (proofread by Claude)"
      },
      "assistant_text": "Makes perfect sense. The latest cut stays as prettified JSON (readable on GitHub), and when the *next* cut happens, the previous cut's JSON gets compressed and its session log link updated. One uncompressed journal visible at all times.\n\n[Updated CLAUDE.md cuts section, decompressed v37-journal.json back to prettified JSON, removed tar.gz, updated v37-session.md link, wrote v38 journal for this turn, committed and pushed.]",
      "tool_calls": [
        {
          "sequence": 1,
          "tool": "Read",
          "parameters": {
            "file_path": "/home/claude/projects/inthebeginning/CLAUDE.md",
            "offset": 255,
            "limit": 30
          },
          "result": {
            "output": "- `user_input.proofread`: Typo/grammar-corrected version\n- `assistant_text`: Full assistant response text shown on screen (no cap)\n- `tool_calls[]`: Every tool invocation with verbatim parameters and output\n- `files_modified`, `files_read`: File access log for the turn\n\n#### Truncation\n\nPer tool call result: if output exceeds **500 lines or 60,000 characters**,\nkeep the first **100 lines or 12,000 characters** (whichever limit hits first).\nAppend a truncation marker with original size and brief description of remaining\ncontent. This applies uniformly to all tools (Bash, Read, Agent, Grep, etc.).\nWithin Agent subagent results, individual command outputs follow the same rule.\n\n#### Redaction\n\nReplace API keys, tokens, passwords, and non-project emails with\n`<REDACTED:type>`. Do not redact system paths, git SHAs, filenames, or\nproject structure.\n\n#### Cuts and Version Bumps\n\nA cut occurs at each solution milestone (logical completion of a version).\nEach cut bumps the solution version number (v37 -> v38). On cut:\n\n1. Populate the journal's `cut` field with version, commit SHAs, and summary\n2. Compress: `tar czf v{VER}-journal.json.tar.gz v{VER}-journal.json`\n3. Delete the uncompressed `v{VER}-journal.json`\n4. Write `v{VER}-session.md` referencing the `.tar.gz`\n5. Update `RELEASE_HISTORY.md` with the version entry\n6. Commit and push",
            "truncated": false,
            "original_length_lines": 30,
            "original_length_chars": 1380
          }
        },
        {
          "sequence": 2,
          "tool": "Read",
          "parameters": {
            "file_path": "/home/claude/projects/inthebeginning/CLAUDE.md",
            "offset": 284,
            "limit": 15
          },
          "result": {
            "output": "6. Commit and push\n\nThe journal stays **uncompressed during active work** (crash recovery).\nCompression happens only at cut time.\n\n#### Schema\n\nDefined in `session_logs/journal_schema.json` (format version 2.0).\nHistorical files under `transcript_schema.json` (v1) are unchanged.\n\n### Rolling Window & Append-Only\n\n- Keep the 3 most recent session logs as raw markdown files\n- Compress older logs into `session_logs/archive.tar.gz`\n- Session logs are append-only per turn -- do not rewrite historical entries",
            "truncated": false,
            "original_length_lines": 15,
            "original_length_chars": 510
          }
        },
        {
          "sequence": 3,
          "tool": "Edit",
          "parameters": {
            "file_path": "/home/claude/projects/inthebeginning/CLAUDE.md",
            "old_string": "A cut occurs at each solution milestone... [replaced compression strategy]",
            "new_string": "A cut occurs at each solution milestone... [latest cut stays prettified, previous cut compressed]"
          },
          "result": {
            "output": "Edit applied successfully",
            "truncated": false,
            "original_length_lines": 1,
            "original_length_chars": 24
          }
        },
        {
          "sequence": 4,
          "tool": "Bash",
          "parameters": {
            "command": "cd /home/claude/projects/inthebeginning/session_logs && tar xzf v37-journal.json.tar.gz && ls -la v37-journal.json v37-journal.json.tar.gz"
          },
          "result": {
            "output": "-rw-rw-r-- 1 claude claude 64297 Apr  4 18:11 v37-journal.json\n-rw-rw-r-- 1 claude claude 14466 Apr  4 18:11 v37-journal.json.tar.gz",
            "truncated": false,
            "original_length_lines": 2,
            "original_length_chars": 137
          }
        },
        {
          "sequence": 5,
          "tool": "Bash",
          "parameters": {
            "command": "cd /home/claude/projects/inthebeginning && python3 -c \"import json; j=json.load(open('session_logs/v37-journal.json')); print(f'Valid: {len(j[\\\"turns\\\"])} turns, cut={j[\\\"cut\\\"][\\\"version\\\"]}')\""
          },
          "result": {
            "output": "Valid: 6 turns, cut=v37",
            "truncated": false,
            "original_length_lines": 1,
            "original_length_chars": 22
          }
        },
        {
          "sequence": 6,
          "tool": "Bash",
          "parameters": {
            "command": "rm session_logs/v37-journal.json.tar.gz"
          },
          "result": {
            "output": "",
            "truncated": false,
            "original_length_lines": 0,
            "original_length_chars": 0
          }
        },
        {
          "sequence": 7,
          "tool": "Edit",
          "parameters": {
            "file_path": "/home/claude/projects/inthebeginning/session_logs/v37-session.md",
            "old_string": "Full turn-by-turn transcript: [v37-journal.json.tar.gz](v37-journal.json.tar.gz)",
            "new_string": "Full turn-by-turn transcript: [v37-journal.json](v37-journal.json)"
          },
          "result": {
            "output": "Edit applied successfully",
            "truncated": false,
            "original_length_lines": 1,
            "original_length_chars": 24
          }
        },
        {
          "sequence": 8,
          "tool": "Write",
          "parameters": {
            "file_path": "/home/claude/projects/inthebeginning/session_logs/v38-journal.json"
          },
          "result": {
            "output": "File created successfully",
            "truncated": false,
            "original_length_lines": 1,
            "original_length_chars": 24
          }
        }
      ],
      "files_modified": [
        "CLAUDE.md",
        "session_logs/v37-session.md",
        "session_logs/v38-journal.json"
      ],
      "files_read": [
        "CLAUDE.md",
        "session_logs/v37-journal.json"
      ],
      "redactions": []
    }
  ],
  "cut": null
}
