{
  "$schema": "journal_schema.json",
  "format_version": "2.0",
  "session": {
    "session_id": "v39",
    "branch": "develop",
    "started_at": "2026-04-04 09:25 CT (14:25 UTC)",
    "previous_version": "v38"
  },
  "turns": [
    {
      "turn_number": 1,
      "timestamp_ct": "2026-04-04 09:25 CT",
      "timestamp_utc": "2026-04-04 14:25 UTC",
      "user_input": {
        "raw": "Okay, and should you have produced a new v38-session.md to reflect the \"cut\"? It was nice to see the v37 full JSON as we were just getting things in shape here. Although I would have understood if the v37 full JSON had been compressed. I see that you do plan to compress the v37 JSON. But, seeing as you're going to be doing a v39 cut, think about this for a moment: you also should compress the v38 JSON. It's just the v39 JSON that shouldn't be compressed when you do this next v39 cut; the v39 cut should be to firm up the logic here; I know incrementing and handling this sort of stuff is actually mildly tricky even if in principle it sounds not too difficult.",
        "proofread": "Should you have produced a new v38-session.md to reflect the cut? It was nice to see the v37 full JSON as we were just getting things in shape here, although I would have understood if the v37 full JSON had been compressed. I see that you do plan to compress the v37 JSON. But, seeing as you're going to be doing a v39 cut, think about this for a moment: you should also compress the v38 JSON. It's just the v39 JSON that shouldn't be compressed when you do this next v39 cut. The v39 cut should firm up the logic here; I know incrementing and handling this sort of stuff is actually mildly tricky even if in principle it sounds not too difficult.",
        "source": "user (proofread by Claude)"
      },
      "assistant_text": "You're right on both counts. v38 should have had a session log and proper cut, and on the v39 cut I need to compress *all* prior uncompressed journals (v37 and v38), not just the immediately previous one. Let me fix this properly.\n\n[Retroactively finalized v38 cut with session log. Updated CLAUDE.md to clarify: compress ALL prior uncompressed journals on each cut, not just the previous one. Compressed both v37 and v38 journals, updated their session log links, wrote v39 journal and session log.]",
      "tool_calls": [
        {
          "sequence": 1,
          "tool": "Read",
          "parameters": {
            "file_path": "/home/claude/projects/inthebeginning/session_logs/v38-journal.json",
            "limit": 10
          },
          "result": {
            "output": "{\n  \"$schema\": \"journal_schema.json\",\n  \"format_version\": \"2.0\",\n  \"session\": {\n    \"session_id\": \"v38\",\n    \"branch\": \"develop\",\n    \"started_at\": \"2026-04-04 09:05 CT (14:05 UTC)\",\n    \"previous_version\": \"v37\"\n  },\n  \"turns\": [",
            "truncated": false,
            "original_length_lines": 10,
            "original_length_chars": 252
          }
        },
        {
          "sequence": 2,
          "tool": "Bash",
          "parameters": {
            "command": "git log --oneline 00bf259..21ad4c0"
          },
          "result": {
            "output": "21ad4c0 fix(v38): keep latest journal uncompressed, compress only on next cut",
            "truncated": false,
            "original_length_lines": 1,
            "original_length_chars": 77
          }
        },
        {
          "sequence": 3,
          "tool": "Read",
          "parameters": {
            "file_path": "/home/claude/projects/inthebeginning/session_logs/v38-journal.json",
            "offset": 140,
            "limit": 10
          },
          "result": {
            "output": "      \"files_read\": [\n        \"CLAUDE.md\",\n        \"session_logs/v37-journal.json\"\n      ],\n      \"redactions\": []\n    }\n  ],\n  \"cut\": null\n}\n",
            "truncated": false,
            "original_length_lines": 10,
            "original_length_chars": 155
          }
        },
        {
          "sequence": 4,
          "tool": "Edit",
          "parameters": {
            "file_path": "/home/claude/projects/inthebeginning/session_logs/v38-journal.json",
            "old_string": "\"cut\": null",
            "new_string": "\"cut\": { \"version\": \"v38\", \"semver\": \"v0.38.0\", ... }"
          },
          "result": {
            "output": "Edit applied successfully",
            "truncated": false,
            "original_length_lines": 1,
            "original_length_chars": 24
          }
        },
        {
          "sequence": 5,
          "tool": "Write",
          "parameters": {
            "file_path": "/home/claude/projects/inthebeginning/session_logs/v38-session.md"
          },
          "result": {
            "output": "File created successfully",
            "truncated": false,
            "original_length_lines": 1,
            "original_length_chars": 24
          }
        },
        {
          "sequence": 6,
          "tool": "Edit",
          "parameters": {
            "file_path": "/home/claude/projects/inthebeginning/CLAUDE.md",
            "old_string": "Compress the **previous** cut's journal...",
            "new_string": "Compress **all** prior uncompressed journals..."
          },
          "result": {
            "output": "Edit applied successfully",
            "truncated": false,
            "original_length_lines": 1,
            "original_length_chars": 24
          }
        },
        {
          "sequence": 7,
          "tool": "Write",
          "parameters": {
            "file_path": "/home/claude/projects/inthebeginning/future_memories/v39-plan.md"
          },
          "result": {
            "output": "File created successfully",
            "truncated": false,
            "original_length_lines": 1,
            "original_length_chars": 24
          }
        },
        {
          "sequence": 8,
          "tool": "Bash",
          "parameters": {
            "command": "git add future_memories/v39-plan.md && git commit -m 'docs: v39 plan — journal compression logic finalization'"
          },
          "result": {
            "output": "[develop e6700da] docs: v39 plan — journal compression logic finalization\n 1 file changed, 16 insertions(+)\n create mode 100644 future_memories/v39-plan.md",
            "truncated": false,
            "original_length_lines": 3,
            "original_length_chars": 156
          }
        },
        {
          "sequence": 9,
          "tool": "Bash",
          "parameters": {
            "command": "cd /home/claude/projects/inthebeginning/session_logs && tar czf v37-journal.json.tar.gz v37-journal.json && rm v37-journal.json && tar czf v38-journal.json.tar.gz v38-journal.json && rm v38-journal.json"
          },
          "result": {
            "output": "-rw-rw-r-- 1 claude claude 14466 Apr  4 18:30 v37-journal.json.tar.gz\n-rw-rw-r-- 1 claude claude  2738 Apr  4 18:30 v38-journal.json.tar.gz",
            "truncated": false,
            "original_length_lines": 2,
            "original_length_chars": 141
          }
        },
        {
          "sequence": 10,
          "tool": "Edit",
          "parameters": {
            "file_path": "/home/claude/projects/inthebeginning/session_logs/v37-session.md",
            "old_string": "v37-journal.json",
            "new_string": "v37-journal.json.tar.gz"
          },
          "result": {
            "output": "Edit applied successfully",
            "truncated": false,
            "original_length_lines": 1,
            "original_length_chars": 24
          }
        },
        {
          "sequence": 11,
          "tool": "Edit",
          "parameters": {
            "file_path": "/home/claude/projects/inthebeginning/session_logs/v38-session.md",
            "old_string": "v38-journal.json",
            "new_string": "v38-journal.json.tar.gz"
          },
          "result": {
            "output": "Edit applied successfully",
            "truncated": false,
            "original_length_lines": 1,
            "original_length_chars": 24
          }
        },
        {
          "sequence": 12,
          "tool": "Write",
          "parameters": {
            "file_path": "/home/claude/projects/inthebeginning/session_logs/v39-journal.json"
          },
          "result": {
            "output": "File created successfully",
            "truncated": false,
            "original_length_lines": 1,
            "original_length_chars": 24
          }
        }
      ],
      "files_modified": [
        "CLAUDE.md",
        "future_memories/v39-plan.md",
        "session_logs/v37-session.md",
        "session_logs/v38-journal.json",
        "session_logs/v38-session.md",
        "session_logs/v39-journal.json"
      ],
      "files_read": [
        "session_logs/v38-journal.json"
      ],
      "redactions": []
    }
  ],
  "cut": {
    "version": "v39",
    "semver": "v0.39.0",
    "finalized_at": "2026-04-04 13:30 CT (18:30 UTC)",
    "commit_shas": [
      "e6700da — docs: v39 plan — journal compression logic finalization"
    ],
    "summary": "Finalized journal compression lifecycle: on each cut, compress ALL prior uncompressed journals (not just the immediately previous one). Retroactively cut v38 with session log. Compressed v37 + v38, leaving only v39 uncompressed."
  }
}
