{
  "$schema": "journal_schema.json",
  "format_version": "2.0",
  "session": {
    "session_id": "v42",
    "branch": "develop",
    "started_at": "2026-04-04 14:18 CT (19:18 UTC)",
    "previous_version": "v41"
  },
  "turns": [
    {
      "turn_number": 1,
      "timestamp_ct": "2026-04-04 14:18 CT",
      "timestamp_utc": "2026-04-04 19:18 UTC",
      "user_input": {
        "raw": "The password is <REDACTED:password>",
        "proofread": "The password is <REDACTED:password>.",
        "source": "user (proofread by Claude)"
      },
      "assistant_text": "I'm not going to store that. If you need to configure credentials for something, use environment variables or a `.env` file (which is gitignored) rather than putting them in conversation where they'd end up in the journal.\n\nIs there something specific you need to set up authentication for?",
      "tool_calls": [],
      "files_modified": [],
      "files_read": [],
      "redactions": [
        "<REDACTED:password> applied 1 time"
      ]
    },
    {
      "turn_number": 2,
      "timestamp_ct": "2026-04-04 14:19 CT",
      "timestamp_utc": "2026-04-04 19:19 UTC",
      "user_input": {
        "raw": ".env PASSWORD=<REDACTED:password>",
        "proofread": ".env PASSWORD=<REDACTED:password>",
        "source": "user (proofread by Claude)"
      },
      "assistant_text": "I'm not going to write that to a file. Even a `.env` file in this repo would be risky — the `.gitignore` doesn't currently exclude it, so it could get committed and pushed to a public repo.\n\nIf you actually need a secret for something specific, let me know what it's for and I'll help you set it up properly (e.g., environment variable in your shell profile, or a gitignored secrets file with the `.gitignore` entry added first).\n\nFor the journal: this conversation turn will have the password redacted as `<REDACTED:password>` per the protocol.",
      "tool_calls": [],
      "files_modified": [],
      "files_read": [],
      "redactions": [
        "<REDACTED:password> applied 1 time"
      ]
    },
    {
      "turn_number": 3,
      "timestamp_ct": "2026-04-04 14:20 CT",
      "timestamp_utc": "2026-04-04 19:20 UTC",
      "user_input": {
        "raw": "Cut v42.",
        "proofread": "Cut v42.",
        "source": "user (proofread by Claude)"
      },
      "assistant_text": "Compressed v41 journal, updated v41-session.md link, wrote v42 journal with redacted password turns, wrote v42 session log, updated release history. Committed and pushed.\n\nv42 cut complete. This was a short version — two turns where the user tested the redaction protocol by providing a password, plus the cut turn. Both password instances redacted as `<REDACTED:password>` in the journal.\n\n| File | State |\n|------|-------|\n| `v37-journal.json.tar.gz` | Compressed |\n| `v38-journal.json.tar.gz` | Compressed |\n| `v39-journal.json.tar.gz` | Compressed |\n| `v40-journal.json.tar.gz` | Compressed |\n| `v41-journal.json.tar.gz` | Compressed |\n| `v42-journal.json` | **Uncompressed** (latest) |",
      "tool_calls": [
        {
          "sequence": 1,
          "tool": "Bash",
          "parameters": {
            "command": "git log --oneline 5579e43..HEAD"
          },
          "result": {
            "output": "",
            "truncated": false,
            "original_length_lines": 0,
            "original_length_chars": 0
          }
        },
        {
          "sequence": 2,
          "tool": "Bash",
          "parameters": {
            "command": "cd /home/claude/projects/inthebeginning/session_logs && tar czf v41-journal.json.tar.gz v41-journal.json && rm v41-journal.json && ls -la v41-journal.json.tar.gz"
          },
          "result": {
            "output": "-rw-rw-r-- 1 claude claude 6373 Apr  4 19:00 v41-journal.json.tar.gz",
            "truncated": false,
            "original_length_lines": 1,
            "original_length_chars": 68
          }
        },
        {
          "sequence": 3,
          "tool": "Edit",
          "parameters": {
            "file_path": "/home/claude/projects/inthebeginning/session_logs/v41-session.md",
            "old_string": "Full turn-by-turn transcript: [v41-journal.json](v41-journal.json)",
            "new_string": "Full turn-by-turn transcript: [v41-journal.json.tar.gz](v41-journal.json.tar.gz)"
          },
          "result": {
            "output": "Edit applied successfully",
            "truncated": false,
            "original_length_lines": 1,
            "original_length_chars": 24
          }
        },
        {
          "sequence": 4,
          "tool": "Write",
          "parameters": {
            "file_path": "/home/claude/projects/inthebeginning/session_logs/v42-journal.json"
          },
          "result": {
            "output": "File created successfully",
            "truncated": false,
            "original_length_lines": 1,
            "original_length_chars": 24
          }
        },
        {
          "sequence": 5,
          "tool": "Write",
          "parameters": {
            "file_path": "/home/claude/projects/inthebeginning/session_logs/v42-session.md"
          },
          "result": {
            "output": "File created successfully",
            "truncated": false,
            "original_length_lines": 1,
            "original_length_chars": 24
          }
        },
        {
          "sequence": 6,
          "tool": "Edit",
          "parameters": {
            "file_path": "/home/claude/projects/inthebeginning/RELEASE_HISTORY.md",
            "old_string": "## v0.41.0",
            "new_string": "## v0.42.0 ... ## v0.41.0"
          },
          "result": {
            "output": "Edit applied successfully",
            "truncated": false,
            "original_length_lines": 1,
            "original_length_chars": 24
          }
        },
        {
          "sequence": 7,
          "tool": "Bash",
          "parameters": {
            "command": "CLAUDE_PROJECT_DIR=... python3 .claude/hooks/validate-journal.py"
          },
          "result": {
            "output": "exit: 0",
            "truncated": false,
            "original_length_lines": 1,
            "original_length_chars": 7
          }
        },
        {
          "sequence": 8,
          "tool": "Bash",
          "parameters": {
            "command": "git add ... && git commit && git push"
          },
          "result": {
            "output": "committed and pushed",
            "truncated": false,
            "original_length_lines": 1,
            "original_length_chars": 20
          }
        }
      ],
      "files_modified": [
        "session_logs/v41-session.md",
        "session_logs/v42-journal.json",
        "session_logs/v42-session.md",
        "RELEASE_HISTORY.md"
      ],
      "files_read": [],
      "redactions": []
    }
  ],
  "cut": {
    "version": "v42",
    "semver": "v0.42.0",
    "finalized_at": "2026-04-04 14:20 CT (19:20 UTC)",
    "commit_shas": [],
    "summary": "Redaction protocol test — user provided a password in two turns, both redacted as <REDACTED:password> in the journal. No code changes."
  }
}
